,title,selftext,url,domain,time,author,date
0,Taiwan granted ASF-free status by WOAH,,"https://taiwantoday.tw/news.php?unit=2,6,10,15,18&amp;post=261098",taiwantoday.tw,2024-11-04 16:31:21,Exastiken,2024-11-04
1,Birthday month dining offers,"I heard that Taiwan has some awesome birthday dining deals. Do you know any good ones or have a favorite? I recently heard that New Mala Hotpot has more beef options if you go during your birthday month, and that sounds pretty cool! Is there a list anywhere that has details about this? My gf's birthday is this month! ",https://www.reddit.com/r/taiwan/comments/1gjhigm/birthday_month_dining_offers/,self.taiwan,2024-11-04 15:52:20,izzyk000,2024-11-04
2,How to know if its a scam?,"So I'm going to travel to Taiwan next week and I contacted a seller that is currently selling a digicam. The model is a Sony Cybershot DSC-HX7V. In my country, it is being sold between 3550NTD - 4400NTD but the seller in Taiwan is selling it for 2000NTD but I managed to bargain it down to 1500NTD. We plan to meet at Taipei Station for the transaction but I'm being reluctant because I'm not trying to be scammed.",https://www.reddit.com/r/taiwan/comments/1gjhbz4/how_to_know_if_its_a_scam/,self.taiwan,2024-11-04 15:44:58,Guilty_Pair517,2024-11-04
3,Received a package that never was ordered. Now company that shipped it wants it back,"Received an unknown package that turned to be what looked like used junk with some small spiders crawling around inside. I re-taped it and placed in a  trash bag.  
After about a week i decided to just dispose of it at the recycling center of my apartment community.  A month later i got a text message from someone claiming to that the item was sent to me by mistake.  Anyone know what liabilities I may have?  
Never heard of this company and I have no idea how they got my name, address and phone number in the first place.

Amended:  
Trying to keep this short;  as some have mentioned this is probably some scam. I thought this also, so I did not bother contacting the shipper before disposing of the box of contents.   
  
However, I just did a quick google and apparently there is some law that says there may be some penalties for refusing to return mailed items shipped by mistake. I'm flabbergasted. Where I am from, we have no such obligation.  
  
""Article 39  Intentional refusal to return mail items that were received by mistake shall be subject to a fine of NT$2,000 to NT$10,000.""

[https://law.moj.gov.tw/ENG/LawClass/LawAll.aspx?pcode=K0050001](https://law.moj.gov.tw/ENG/LawClass/LawAll.aspx?pcode=K0050001)",https://www.reddit.com/r/taiwan/comments/1gjh0dy/received_a_package_that_never_was_ordered_now/,self.taiwan,2024-11-04 15:31:22,Odd_Mango_8061,2024-11-04
4,Traveling to Taiwan. Phone question.,"My family have AT&amp;T, does when arriving at TPE does the airport offer sim cards? If they do how to I go about it?",https://www.reddit.com/r/taiwan/comments/1gjf21f/traveling_to_taiwan_phone_question/,self.taiwan,2024-11-04 14:07:18,liminchun,2024-11-04
5,Taiwanese people are the most rude hostile people I’ve ever met in my life and Taiwan is much worse than other countries in Asia.,"Having just had yet another rude hostile interaction with a Taiwanese, this time in family mart, I now feel so fed up with Taiwan and the Taiwanese and want to leave ASAP. This woman at family mart literally shouted at me for daring to ask for syrup in my coffee. She shouted at me in Chinese in front of some other customers and I was so embarrassed and I had no idea what she was saying.

On Friday I made a post detailing how I felt Taiwan wasn’t what a lot of people on this sub make it out to be and now I want to give a follow up with some further points for the benefit of people in the rest of the world who may be considering Taiwan as a place to live.

Let’s start with the “Taiwanese are so friendly” nonsense

Since coming here I’ve had to deal with so many hostile people, with several Interactions a week like the one I mentioned that happened to me today. Everyone looks at you like you’re an alien. Parents pull their children away from you. You walk into a restaurant and the staff try to ignore you. In my condo people are so unfriendly they will wait for another lift rather than getting into the same lift as someone else. My hotel I stayed at when I first got here, the staff tried to get everyone using a self-check in because they didn’t want to have to interact with anyone. Service staff would rather blame you than accepting their mistakes. The whole culture feels incredible rude and hostile.

I would advise anyone coming here to not expect to make a single Taiwanese friend, they don’t want to be friends. They don’t even get on well with each other, if you str and look at the people walking on the road or in a ma they will all have grumpy hostile face expressions. Groups of people walk together but they don’t talk or laugh with each other, they would rather just walk silently. Same in a restaurant, restaurants are often very quiet because nobody is talking to each other, they all just eat and look at their phones.

I would also advise anyone coming here that any potentially friendly interaction you have with a Taiwanese will be immensely fake and they will be hoping you leave them and go away as soon as possible or give them something (money).

I don’t mind this since I’m only here temporarily and I came with some other foreign friends but it would be very tough if you’re planning to move here long term.

Some other things which I really hate about Taiwan that never gets mentioned on this sub.

1. The public toilets. This supposedly developed modern country still has disgusting squat toilets all over the place. No modern country has these. Most supposedly poorer countries in south east Asia now have sit down toilets with bum gun as standard, Japan and Korea have bidet toilets as standard. Taiwan is terribly far behind with this.

2. Together with the squat toilets you will see bins full of disgusting soiled toilet paper. This is totally unnecessary and disgusting. I’ve never seen this anywhere else and it makes me hate Taiwan everytime I see it.

3. The weather here is consistently awful. Summer is so unbearably hot you can’t even go outside at night without sweating (this is different to SE Asia where temperature cools down significantly at night). Mos days are horribly grey, rainy and overcast. I’ve counted 18 rainy days in a row since I came here as well as 2 typhoons. You’ll be forced to spend a lot of time indoors if you come to Taiwan.

4. The night markets. I can’t believe these are actual tourist attractions. They are hot, crowded and dirty with nowhere to sit. Go to Thailand if you want night markets. In Thailand every stand has ample seats and tables around it to sit and eat. As well as lots of clothes and accessory shops thrown in and concert stages for live bands to perform on (it’s really fun). You certainly won’t get that in Taiwan.

5. The garbage collection. Fortunately I don’t have to deal with this nonsense where I live. But the whole garbage collection situation is so ridiculous and unnecessary. The fact anyone can describe Taiwan as a convenient country when they have this system blows my mind.

6. Things take ages to repair when broken. One of The elevators broke in my building and wasn’t repaired for about two weeks, everywhere else I’ve lived this would be fixed in a day or 2 max. Not to mention the fact places are constantly turning off the elevators “to save electricity” forcing everyone to wait longer.

7. Constant sewage smell everywhere. When you’re walking just outside 101 mall you don’t expect to be breathing in sewage. Enough said.

8. Terrible tourist infrastructure. It’s embarrassing when people come to visit me and I have to recommend such a bad selection of hotels for them to stay at. Not to mention the fact all the beaches here are totally undeveloped with no beach resorts, beach clubs etc like other countries. A lot of beaches here are covered in garbage.

9. Bad breath everywhere. I’ve never come across so many otherwise perfectly respectable people who otherwise have terrible breath as in Taiwan. Especially in the morning. It is so disgusting and I don’t know why it’s so bad here. 


I'm posting this to give some balance to this incredibly delusion sub. We had someone yesterday asking something about the paper towels in restaurants and phrasing their question ""I love taiwan but ......?, I love Taiwan so much"" like seriously just ask your question. Pretty much every other country sub that I'm on people can just ask their questions and make comments about a place without all this weird profession of love that we see here.

Anyway downvote away 😉
But people abroad will find this useful.",https://www.reddit.com/r/taiwan/comments/1gjemct/taiwanese_people_are_the_most_rude_hostile_people/,self.taiwan,2024-11-04 13:47:48,Leading_Concept_7997,2024-11-04
6,geekr inc taipei city,I noticed there is 2 times 100 TWD charges on my credit card by this company when I was travelling in Taipei last week...anyone have any idea on what is this company/transaction about?,https://www.reddit.com/r/taiwan/comments/1gjdzq1/geekr_inc_taipei_city/,self.taiwan,2024-11-04 13:17:47,Accomplished-Pass-72,2024-11-04
7,Wanted notice issued in green tech fraud case - Taipei Times,,https://www.taipeitimes.com/News/taiwan/archives/2024/11/04/2003826370,taipeitimes.com,2024-11-04 12:52:40,wallabies7,2024-11-04
8,Shoe inserts Taipei,"Have you ever seen shoe inserts sold here? Dr. Scholls type stuff? In most countries any big pharmacy will sell them but I went to 5 different pharmacies, including Watsons and Cosmed here and no one had them, I asked and showed the staff pics on my phone but they were clueless. 

Any ideas?",https://www.reddit.com/r/taiwan/comments/1gjddw4/shoe_inserts_taipei/,self.taiwan,2024-11-04 12:46:53,Dropshipflip,2024-11-04
9,Sanhe JHS Station,"Hi, flight ko na bukas. Sa mga nakapunta na ng Taiwan, paano po pumunta ng Sanhe Station from Taoyuan Airport? Penge po details. Thank youuuuuu! 😭🥹
",https://www.reddit.com/r/taiwan/comments/1gjcmhx/sanhe_jhs_station/,self.taiwan,2024-11-04 12:04:46,Calm-Agency-2793,2024-11-04
10,Need Medical Oncologists for an Online Paid Surveys,"Hi, If any medical Oncologist is here or anybody knows please reach out!! 

Any MD specializing in Esophageal/GI tract cancer. I have an Online Paid Survey opportunity. ",https://www.reddit.com/r/taiwan/comments/1gjc4hc/need_medical_oncologists_for_an_online_paid/,self.taiwan,2024-11-04 11:34:51,Decent_Reception_475,2024-11-04
11,Stand or Walk on Left Side Taipei MRT,"Just ran to you an individual standing on the left side of the escalator at Guting Station.  I asked him why he was standing on the left and he said there was a recent rule change / suggestion that stated individuals should stand on both sides of the escalator. 

??

I found the press release and translated the bold section.  From what was translated, the article doesn't explicitly say what folks should do.  It seems a bit ambiguous. 

""In the near future, we will further study the use of signs and broadcasts at important interchange stations such as Taipei Main Station during peak hours, strengthen the promotion of standing on both sides, and accelerate the alleviation of crowds.""

https://www.metro.taipei/News_Content.aspx?n=30CCEFD2A45592BF&amp;sms=72544237BBE4C5F6&amp;s=720C3381BDB1FE7E

Here's another article, which sites the official MRT press release where it says that it says it's encouraged: 

https://www.taiwannews.com.tw/news/5958515

I'm still a little initially annoyed / confused but I'll take a look at what the London research says and update later.",https://www.reddit.com/r/taiwan/comments/1gjb6g1/stand_or_walk_on_left_side_taipei_mrt/,self.taiwan,2024-11-04 10:30:36,ThinkingIs2Hard,2024-11-04
12,Fraud (asking for advice),"Hi everyone, so my friend, m(29), taiwanese, got a letter from a presecutor (subpoena) to attend a court. Apperently, one of his friend use his bank account to do fraud things, and now people are sueing my friend. They want my friend to give back their money. 1.100.000 NTD. The presecutor told him that all he can do is either pay it or go to the jail. I'm here asking for advice.. is there anything he can do? He tried to hire lawyer from government, but they said they are not helping him if its a fraud case. TIA",https://www.reddit.com/r/taiwan/comments/1gjav3c/fraud_asking_for_advice/,self.taiwan,2024-11-04 10:07:38,korkov01,2024-11-04
13,How do you pay the bill for NHI? (National Health Insurance),"Hi, I just graduated from university, and currently unemployed and seeking for a job. I just renewed my NHI (Health Insurance Card), and I was wondering how to pay for the insurance fee? I haven't received any insurance bill. Does the bill only shows up whenever I use the insurance card at a hospital or clinic or is it billed to us monthly? And how do they send the bill? Via mail, email, SMS?",https://www.reddit.com/r/taiwan/comments/1gjamow/how_do_you_pay_the_bill_for_nhi_national_health/,self.taiwan,2024-11-04 09:50:28,EconomyFreedom4081,2024-11-04
14,IQOS in Taiwan,"Hi everyone!

I’ll be in Taiwan for two weeks in November and was wondering if it is legal to bring and smoke IQOS (terea) and if it’s possible to buy it there.

Thanks in advance for any updates :) ",https://www.reddit.com/r/taiwan/comments/1gj8im6/iqos_in_taiwan/,self.taiwan,2024-11-04 07:03:05,triple_rayquaza,2024-11-04
15,Master’s degree at NTU vs europe,"I’m graduating with a bachelor’s in engineering and weighing whether to continue at my own school in Finland (Decently well recognised and ranked engineering university, top 150-200) vs applying to NTU. I’m looking specifically at the master’s programme in semiconductor technology at the graduate school of advanced technology.

I did an exchange period at NTUST and really miss the studying life in Taipei. After my undergrad I’ve decided that the semiconductor industry is where I want to focus on. The industry is growing all over the world, including Finland where I’m from. I also have a lot of friends in Taiwan and generally wouldn’t mind working here at least while I’m young and don’t have kids. My mandarin is currently at TOCFL B level, and I can keep up quite well with conversation in mandarin only in a friend group. I imagine NTU would have the best semiconductor industry connections of almost any university, so with all the above factors, NTU is looking very tempting. However, I’m also aware of the downsides (asian degrees might not be as well recognized globally, and obviously Taiwan has much worse work culture)

Is it better to finish my degree quickly at home and then apply for jobs in Taiwan, or should I jump ship and do a master’s at NTU? Any advice is appreciated!",https://www.reddit.com/r/taiwan/comments/1gj8627/masters_degree_at_ntu_vs_europe/,self.taiwan,2024-11-04 06:37:47,NoMoreEvilHippies,2024-11-04
16,where to report typhoon damage,"just looking out of my window, i can see three different roofs that have been half blown off by kong rey. not sure when they'll fully dislodge and fall off and potentially hurt someone. who should this be reported to?",https://www.reddit.com/r/taiwan/comments/1gj6972/where_to_report_typhoon_damage/,self.taiwan,2024-11-04 04:31:42,ipromiseillbegd,2024-11-04
17,Best Taiwanese food that you think people should try?,"I wonder if you guys can share some of your ""must-try food"" that is not the usual ""go-to"" restaurants for tourists (specifically the location and if possible the timing of visit to avoid the crowd)

for example:  
stinky tofu -&gt; i assume there are many places that sell it, but where should i go?  
night market -&gt; do you have a specific stall that you think worth trying?

The kind of place that you will bring your friends and family to when they visit Taiwan.



I know that this question has been asked multiple times, i did look into the subreddit rules and i hope i do not break any:

* i did look into the wiki - food section -&gt; not up to date(?)
* searched 'food' through this subreddit -&gt; there are a lot of good recommendations, but mostly is about the 'what', not the location
* saw the weekly thread and found 'Generic questions that most likely won't generate discussion as their own thread.' -&gt; i hope this thread will generate some discussion(?)

",https://www.reddit.com/r/taiwan/comments/1gj589x/best_taiwanese_food_that_you_think_people_should/,self.taiwan,2024-11-04 03:32:12,eatfinders,2024-11-04
18,Egret at Da'an Park,,https://i.redd.it/d1zr3xu70tyd1.jpeg,i.redd.it,2024-11-04 03:26:11,markus_takes_photos,2024-11-04
19,"Lost My Item in a Taxi… Or So I Thought, Until I Caught the Driver Swiping It","Still in disbelief this is actually happened.

So yesterday (Sunday), a friend of mine (Taiwanese) is supposed to pick up a cake from a local pastry shop in Taipei.

Initially, the plan is for me to drive there, but since it’s Sunday and traffic is everywhere, I really don’t want to deal with finding a car parking spot later again (I found a sweet spot and just wanted to keep it), so we decide to take a taxi instead.

Uber has at least 10min wait time, and we see 2-3 taxis pass by already, so we just wave, and one minute later we’re inside a yellow car, heading toward our destination.

The plan is to get to the store, pick up the cake, and then take the same taxi back home.

We arrive near the cake place and ask the taxi driver if he can wait for us for two minutes since we’ll be back soon.

Now here’s where it gets interesting: we return to the taxi, and as I get in the backseat, the first thing I notice is that my power bank, which I’ve left right here on the backseat, is gone.

I’m very sure I left the power bank on the backseat (I didn’t take it with me to the cake store), so I start looking around for it. Finally I say to my friend, “This is strange, but I had my power bank right here on the seat, and now it’s gone.”

As we head back, we ask the taxi driver multiple times if he’s seen our power bank or if anyone else might have entered the taxi and taken it, but he denies it.

This really puzzles me since I’m certain I left the power bank on the back seat so no one else except the taxi driver could have moved it.

This is a high-end power bank that’s been useful on countless occasions, so I don’t want to just let it go.

We tell the taxi driver that once we arrive, we want to search the car.

We stop on a different street near our destination (I don’t want the taxi driver to know exactly where we’re going), pay the fare, and start looking around.

After a few minutes of searching (including the front glovebox), we’re running out of options—but I know the power bank is somewhere in this car.

I’m tired at this point and just want to end this and get on with the rest of my evening.

So I get out of the car, open the driver’s door, and politely ask him to stand up and get out of the car.

He says he won’t stand up and insists that this is all ridiculous and he doesn’t have time for it.

His reaction makes me feel more suspicious, as it shouldn’t be a big deal for him to stand up and help us search for the lost item.

I look around his seat while he’s sitting there, and then I spot a shiny USB cable coming out from literally beneath him.

I reach out (screw his personal space at this point), grab the cable, and pull the power bank from under his ass.

What. The. Fuck.

So he’s taken it from the back seat while we were away, hid it under his ass, and has been sitting on it the whole time while we search for it like dummies 😭😭

Speechless, I give him that “what the fuck, dude” look and shut the door. 

I am tired, I just want to go home.

The moment I shut the door, he quickly drives off, so I don’t have enough time to snap a photo of his car plate.

Still in disbelief as I type this. This is disappointing on so many levels; never in my life would I have expected someone to try and steal from me in Taiwan in such a dumb way. 
I’m European, and I’d expect this kind of thing at any time, day or night, back in Europe — but not here. And definitely not as a passenger in a taxi.",https://www.reddit.com/r/taiwan/comments/1gj412s/lost_my_item_in_a_taxi_or_so_i_thought_until_i/,self.taiwan,2024-11-04 02:26:25,whitepalladin,2024-11-04
20,What snacks should I ask my mom to get me?,I know about Kid-O and just candies that aren’t available here in the U.S. But what specific snacks do you guys like that you think I should ask my mom to get me while she’s over there? Any and everything is appreciated! (I like sweets and anything that’s good 😅),https://www.reddit.com/r/taiwan/comments/1gj3wxv/what_snacks_should_i_ask_my_mom_to_get_me/,self.taiwan,2024-11-04 02:20:12,imagoofyguy,2024-11-04
21,Father Mentally Abused by Bi-polar Step Mother. Social Services?,"Does anyone know if Taiwan has public social services that can assist my father.  

My step mom is bipolar who refuses to seek medical treatment.  When she is manic (a lot recently). She can talk a lot of shit and do things considered dangerous to my father who is currently ill in the hospital.  

Are there any social services in Taiwan that can force mandatory psychiatric treatment/assessment like in North America 

I tried reaching out the police but they don't want to get involved.  Sayings it a family matter.  

The doctors and nurses all see the signs and are concerned, but when asked to provide a witness statement or report they dont want to get involved.   




",https://www.reddit.com/r/taiwan/comments/1gj3n9w/father_mentally_abused_by_bipolar_step_mother/,self.taiwan,2024-11-04 02:05:59,theg604,2024-11-04
22,Taiwan horror literature,"Hello I wanted to ask, is there any taiwanese horror literature? Like for example taiwanese ryu murakami, coin locke babies etc.. something really violent? 
I am asking because in China its hard to find something like this, because its banned. So are the authors writing in this style? It doesnt need to be translated to english, I am just curious. Thanks!!",https://www.reddit.com/r/taiwan/comments/1gj3ll6/taiwan_horror_literature/,self.taiwan,2024-11-04 02:03:33,Mrtvejmozek,2024-11-04
23,Bakery Options,I am looking for someone to create customized cakes for my birthday. Does anyone know where to get this done in Taipei. Any suggestions would be appreciated. Thankss!!,https://www.reddit.com/r/taiwan/comments/1gj31p9/bakery_options/,self.taiwan,2024-11-04 01:34:54,BruceWay7ne,2024-11-04
