,title,selftext,url,domain,time,author,date
637,United Airlines starting flights to Kaoshiung via Tokyo-Narita,"“Starting July 11, United will be the only U.S. airline to offer direct service to Kaohsiung, Taiwan, a city known for its modern urban landscape, historical harbor and breathtaking nature. From its expansive street art scene to iconic sites, like the Pier-2 Art Center, Love River and Lotus Pond, the city is rich with activities for nature lovers and culture enthusiasts.

United's new year-round service from Tokyo/Narita will provide an easy one-stop option for American travelers looking to visit the city, and complements the airline's twice-daily, nonstop service between San Francisco-Taipei.”",https://united.mediaroom.com/2024-10-10-United-Adds-Eight-New-Destinations-in-Largest-International-Expansion-in-its-History,united.mediaroom.com,2024-10-10 13:56:46,ethospathostrademark,2024-10-10
638,Trash/recycling ,"Okay help 

I have Nivea deodorant spray bottles. Does that go with the tin/aluminum can category or just regular trash? 

I also bought chicken breast (raw) that's been in my fridge sealed. It's a few days past the best by date. It looks fine but I don't wanna chance it lol! How do I throw that away?? Do I take it out of the packaging and throw it in the food waste bin? 

And in general if you have food that's gone off, do you still throw it in the food recycling? Or regular trash? 

Thank you in advance😭🤧",https://www.reddit.com/gallery/1g0hn2x,reddit.com,2024-10-10 13:28:37,mylifestillgoes_on,2024-10-10
639,Lai reasserts sovereignty on Taiwan’s National Day - Focus Taiwan on YouTube,,https://www.youtube.com/watch?v=tgO0Uq3Qv7M,youtube.com,2024-10-10 12:17:17,SHIELD_Agent_47,2024-10-10
640,mahjong places,"Hi everybody, looking for suggestions of places to play mahjong for beginners. we also have no supplies rip💔 thanks for any help
",https://www.reddit.com/r/taiwan/comments/1g0gbqa/mahjong_places/,self.taiwan,2024-10-10 12:11:00,Technical-Play-7555,2024-10-10
641,Sovereignty,"Although the current governing authority is in Taiwan,  in reality they are still different.

&gt;Under the Peace Treaty of April, 1952, Japan formally renounced all right, title and claim to Formosa and the Pescadores; but again this did not operate as a transfer to Chinese sovereignty, whether to the People's Republic of China or to the Chinese Nationalist authorities. Formosa and the Pescadores are therefore, in the view of Her Majesty's Government, territory the de jure sovereignty over which is uncertain or undetermined.

[https://api.parliament.uk/historic-hansard/written-answers/1955/feb/04/formosa-and-the-pescadores-treaties](https://api.parliament.uk/historic-hansard/written-answers/1955/feb/04/formosa-and-the-pescadores-treaties)",https://www.reddit.com/r/taiwan/comments/1g0fwww/sovereignty/,self.taiwan,2024-10-10 11:44:56,taiwanjin,2024-10-10
642,Happy national day Taiwan! 🇺🇦♥️🇹🇼 Love to all Taiwanese people! Stay strong! ,"Greetings to all of the Taiwanese friends from Ukraine! Happy national day!
向烏克蘭的台灣朋友問好！國慶節快樂！",https://www.reddit.com/r/taiwan/comments/1g0fozd/happy_national_day_taiwan_love_to_all_taiwanese/,self.taiwan,2024-10-10 11:29:29,NintendoGameBoyfan,2024-10-10
643,Why I love Taiwan 🇹🇼,"Taiwan has captured my heart in so many ways. From its vibrant culture to its stunning landscapes and friendly people, there's always something new to discover. Whether you're a foodie, a nature lover, or simply looking for a unique travel experience, Taiwan has it all. Here's why I fell in love with this amazing island.

Hbu???",https://www.reddit.com/r/taiwan/comments/1g0eufe/why_i_love_taiwan/,self.taiwan,2024-10-10 10:27:16,Adventurous_Money152,2024-10-10
644,Happy National Day Taiwan !!! 🇹🇼🇹🇼🇹🇼🇹🇼 10-10 ,"I'm so grateful for the four years I've spent living in Taiwan. This beautiful country has given me so much. From the breathtaking landscapes and rich culture to the warm and welcoming people, Taiwan has truly become my second home. Thank you for all the wonderful experiences and memories I've made here 🫡🫡🫡",https://www.reddit.com/r/taiwan/comments/1g0erdq/happy_national_day_taiwan_1010/,self.taiwan,2024-10-10 10:20:38,Adventurous_Money152,2024-10-10
645,(Full speech English translation) President William Lai’s National Day Address,[ Removed by Reddit on account of violating the [content policy](/help/contentpolicy). ],https://www.reddit.com/r/taiwan/comments/1g0dlso/full_speech_english_translation_president_william/,self.taiwan,2024-10-10 08:47:34,Honest_Water3408,2024-10-10
646,🇹🇼 Happy National Day 🇯🇵,Greetings from your buddies up north!,https://www.reddit.com/r/taiwan/comments/1g0dflg/happy_national_day/,self.taiwan,2024-10-10 08:33:46,the2belo,2024-10-10
647,International Driving License recognition,"Basically my question is how does International Driving License (IDL) recognition work in Taiwan.

I have done some research, been to Motor Vehicle Office but I still have not been able to completely understand it and I do not want to get myself into any trouble.

To make things clear, I am a student from Czech Republic currently in Taiwan for an exchange stay. I have got a driving license stating the vehicles I can drive, being **B** (car no heavier than 3,5t) and **AM** (50cc engine motorcycle). In Czechia I received IDL according to **1949 Geneva Convention** which should be recognized in Taiwan (although I have not been able to find any reliable source stating that). I know that here in Taiwan I can use it for one month and then I need to obtain International Driving Permit (IDP). So I have been here for a month and I decided to get the permit so I can maybe try riding a scooter. Everything went smooth, I got the permit without any problems but when I asked what vehicles I am allowed to drive with the class of permit they gave me, the staff said that I can only drive a car here in Taiwan and that they **do not recognize my AM permit here**. Which seemed weird to me because I thought that signatories of the Geneva Convention are supposed to recognize all types of permits in the IDL. However, it gets even more confusing to me as the IDP states that the **Class of IDP is A-普小**. I have been told that the Chinese characters mean something like general small, but the main thing is that according to the IDL, A stands for motorcycles.

I attached pictures so you can see yourselves.

[IDP](https://preview.redd.it/lerzmhh9svtd1.png?width=4032&amp;format=png&amp;auto=webp&amp;s=f4f14f58eda370e35785dcd9fb15101d8b7d07e3)

[my IDL vehicle categories](https://preview.redd.it/alewbr0tqvtd1.png?width=1200&amp;format=png&amp;auto=webp&amp;s=2ddbbcb1dcfa2ae46d0e0623db34da5e5de20e75)

  
I would appreciate a lot if anyone could explain it to me or advise me to any other place or online resource where I could get some more information on this topic.",https://www.reddit.com/r/taiwan/comments/1g0dczb/international_driving_license_recognition/,self.taiwan,2024-10-10 08:27:59,TheGrilias,2024-10-10
648,Taiwan's population continues to decline gradually ,,https://focustaiwan.tw/society/202410090026,focustaiwan.tw,2024-10-10 08:03:21,madrid987,2024-10-10
649,Kazakhstani student wants to study in Taiwan,"Hi guys! Could you please share some information about fully founded scholarships for bachelors? I found MOE Taiwan government scholarship, but I think that it is pretty competitive. I'm thinking about NTU (National Taiwan University) and their fully English taught programs.

I have 4.6/5.0 GPA, some international olympiads and good IELTS with SAT.  
  
I need to cover all my expenses (tuituion, living and etc) because of some financial hardships.

Is there any options? Any scholarships or advices about application? Is MOE scholarship so competitive for me?",https://www.reddit.com/r/taiwan/comments/1g0csvf/kazakhstani_student_wants_to_study_in_taiwan/,self.taiwan,2024-10-10 07:45:24,qantarovec,2024-10-10
650,Happy National Day to Taiwan 🇹🇼. Love from India. 🇮🇳. 🇹🇼🤝🇮🇳. 🇮🇳❤️🇹🇼,"Hello Lovely peeps from Taiwan. I wish you all happiness , peace and Success. 
Love from India ☺️.

As we Indians use to say this in front of PRC Embassy:
""अभी तो बस झांकी है। स्वराज ताइवान तो बाकी है।""

They were super pissed off. 😝😝.

Enjoy your National Day

PS: The abive written sentence in Hindi means that whatever you(CCP) are seeing now is just Preview, Independent Taiwan will soon be realised.
Basically to piss our (Currently occupied) Northern neighbours.",https://www.reddit.com/r/taiwan/comments/1g0bui4/happy_national_day_to_taiwan_love_from_india/,self.taiwan,2024-10-10 06:35:26,Idk_wtf_hs,2024-10-10
651,Bomb threats issued over documentary 'State Organs' in Taiwan,,https://www.taiwannews.com.tw/news/5949560?fbclid=IwY2xjawF0L1NleHRuA2FlbQIxMQABHZADk6fSE69QZyj6hzCSYbw_OKx_el53MI7VOJ5IKR5Olgf72a1r0GOZ0A_aem_BjG6-RAcWqbBhUENfp58xQ,taiwannews.com.tw,2024-10-10 04:55:41,stupidusernamefield,2024-10-10
652,Kaohsiung film festival subtitles,"I tried to research the film festival website but could not find info. Does anyone know if the films on Kaohsiung film festival will have english subtitles (because the norm in cinema seems to be chinese and english)? Or if there is some code or specific term they use to let you know what language the subtitles will be in. 

Thank you!",https://www.reddit.com/r/taiwan/comments/1g0a8hh/kaohsiung_film_festival_subtitles/,self.taiwan,2024-10-10 04:50:23,DiscountSalt,2024-10-10
653,Where should i go what should i do today on the national holiday?,i want to see some parade or something!,https://www.reddit.com/r/taiwan/comments/1g0a80n/where_should_i_go_what_should_i_do_today_on_the/,self.taiwan,2024-10-10 04:49:38,matchakakigori,2024-10-10
654,Quick Methods of Getting Cash? Only brought credit cards and Discover Debit Card. ,"Hello all,

I’m hoping you all could help. I did this really dumb thing of just brining my Discover debit card and credit cards. I know it was dumb to just bring one debit card and have that one debit card be a Discover one. 

When I call their customer service weeks ago, they assured me that so long as I can find ATM that accepts Discover I can withdraw cash  I have my Discover credit card, Chase Sapphire Premier and Citi Strata credit cards.  

I tried using the ATM machines from the TenShin bank (not their actual bank location, only at FamilyMart) and was unsuccessful. My second option was to get a WesternUnion wire transfer, but I didn’t realize it would take multiple days and today is a national holiday so all the banks are closed. When I called Discover today, they said that their debit card only works in the U.S., Canada and Mexico. 

I don’t have any friends or relatives in Taiwan, who I can Venmo or Cash app to and they can give me cash in return. 

If you have any suggestions, please let me know. Thank you so much. ",https://www.reddit.com/r/taiwan/comments/1g06ypb/quick_methods_of_getting_cash_only_brought_credit/,self.taiwan,2024-10-10 01:51:32,multiequations,2024-10-10
655,National Day festivities Tainan,"Hi, are there any festivities planned for the National Day in Tainan? Cheers",https://www.reddit.com/r/taiwan/comments/1g06y53/national_day_festivities_tainan/,self.taiwan,2024-10-10 01:50:45,dao_jones123,2024-10-10
656,Weightlifting gym temporary pass,"Hello, I will be in Taiwan ( Zhubei city) for 3 weeks for work, and I would like to make use of a gym for keeping with my weight training regime. Any recommendations? I don't want to sign up for any long term memberships as I will be in Taiwan infrequently only maybe 1 or 2 times a year... Thanks! ",https://www.reddit.com/r/taiwan/comments/1g06nwq/weightlifting_gym_temporary_pass/,self.taiwan,2024-10-10 01:35:56,northerngood,2024-10-10
657,Seeking help with translation ,"Hello! 

I'd like Reddit's assistance in translating a short message into Chinese. I'll be traveling to Taiwan soon to celebrate my marriage and meet my partner’s family. I would like to express my gratitude to the family members attending the celebration.

Could you please help me craft a message that conveys the sentiment of ""thank you for joining this celebration of our marriage""?

Google gave me, ""您好，非常感謝您參加我們的婚禮慶祝活動。我們非常高興能與您一起分享這個特殊的日子。"" as a starting point.

Thank you!",https://www.reddit.com/r/taiwan/comments/1g05mpb/seeking_help_with_translation/,self.taiwan,2024-10-10 00:44:47,Dear-Anything5439,2024-10-10
658,Need serious help mentally and academically ,"I was an int’l student in the U.S., but due to mental issues transferred back to my home country to keep on doing my bachelor degree.

The decision of studying aboard initially was unforgivably hasty, but it’s the only choice I know with the knowledge/resources I had at that time. I did not enjoy the city and environment, which got me depressed. It became worse, I realized I have to stop, so I transferred back to my home country.

After transferring back, I discovered my fiercely-burning interest in comp neuro. 
Also my vision got wide enough to found that it was the location, school, and the first time being in a foreign country that got me depressed and frustrated. Plus I developed serious elite school complex, so now the school in Taiwan couldn’t satisfy me (I have a feeling that no matter how good the grad school I end up being, this bachelor will follow me forever), also on the reality perspective, it indeed would have me seem one point worse than other applicants in future grad school applications.
So I’m considering transferring back to the U.S., to a school with wisely picked location and at least decent reputation in neuro.
However I am also worried that the two times transfer will just be my criminal record, which might also affects grad school application. 

I’m in a position where I cannot move forward nor backward, I understand the above description might make me seemed immature, clueless and irritating.
But I do seriously need help, psychological support and academic pathway counseling at the same time. To my knowledge there isn’t a therapist that could do both, so if you are/you know someone that happens to be familiar with undergrad system in the U.S., do neuro research, and knows how to settle one’s mind, I would be greatly, greatly appreciated your help, please pm or comment or pm for my Gmail.

I understand my description might seem messy and too straightforward, if you need any clarification, I’m happy to answer! Thanks again!!🫡",https://www.reddit.com/r/taiwan/comments/1g059st/need_serious_help_mentally_and_academically/,self.taiwan,2024-10-10 00:27:22,15tatt,2024-10-10
659,Today is the National Day!!🎊🇹🇼,祖國中華民國🇹🇼113歲生日快樂🎊🎈,https://www.reddit.com/r/taiwan/comments/1g00hrz/today_is_the_national_day/,self.taiwan,2024-10-09 20:55:15,PhysicsFearless8021,2024-10-09
660,Post-earthquake Hualien tourism,Is it safe &amp; worth it to visit Hualien in November?,https://www.reddit.com/r/taiwan/comments/1fzzeyl/postearthquake_hualien_tourism/,self.taiwan,2024-10-09 20:09:40,warpus,2024-10-09
661,Ruptured Achilles - anyone had surgery here to repair or have any recs on doctors or hospitals?  ,"Hi guys - was playing basketball with a few friends last night and tore my achilles. Went to the ER and they confirmed. 

Anyone have any recs on doctors or hospitals that specialize in this type of injury or sports medicine etc?  

Was hoping to find a doc that can do the small incision method which apparently speeds up recovery by half. 

Thank you for anyone that can provide any guidance. Pretty depressed here looking at a 12 month recovery but hoping for the best. ",https://i.redd.it/gf52z52rxrtd1.jpeg,i.redd.it,2024-10-09 19:29:52,WangtaWang,2024-10-09
662,"University Application and Scholarships in Taiwan (Computer Science, Bachelor's degree, English taught) ","I'm currently in grade 12 (born in 2007). I'm thinking of studying Computer Science (CS) English taught in Taiwan. I did some research but still didn't get everything clear. About the MOE Scholarship, I can't find any guidance or requirements for application except for the 2018 one ([Taipei Economic and Cultural Office in Vietnam website](https://www.roc-taiwan.org/vn_en/cat/9.html)). Please recommend other suitable scholarships in Taiwan (like those offered by universities, organizations,...) or sources to get information about them, as well as suitable universities. Thank you so much!

About achievements and awards :

**English certification**:

* 7.0 on the IELTS exam

**High School GPA**:

IT class in a High school for the gifted in Vietnam

* 10th grade: 9.2/10
* 11th grade: 9.5/10
* 12th grade: (didn't finish, aiming for about equal to 10th or 11th grade)

**CS-related activities**:

* First prize in the provincial Informatics Olympiad 2023
* Bronze medal in the Central and Central Highlands Regional Competitive Programming (CP) Contest 2024
* Third prize in the HSGS (HUS High School for Gifted Students) Informatics Olympiad 2024

(all in Vietnam)

Can I compete for the MOE Scholarship or other scholarships for this profile?

Please take a look and review my profile and help me answer my questions. I appreciate your attention to this matter. Thank you for your time and consideration! Sorry for my bad English writing skills.",https://www.reddit.com/r/taiwan/comments/1fzxc84/university_application_and_scholarships_in_taiwan/,self.taiwan,2024-10-09 18:42:17,Ok-Membership8756,2024-10-09
663,Coffee shops Etiquette,"Hello! I'm a foreigner working here in Taiwan. Since tomorrow is holiday and I'm planning to go out but still work, I'm planning to do it in a coffee shop near my place.

However, I don't know if that's accepted here in Taiwan? Not that I'm gonna stay the whole day, just a couple of hours. I just want to have a different environment other than my small room 😅

Would love to hear your experiences and advice.",https://www.reddit.com/r/taiwan/comments/1fzumdi/coffee_shops_etiquette/,self.taiwan,2024-10-09 16:49:15,AwkwardSmartMouth,2024-10-09
664,weather in taiwan on december,"hi!! i will be going to taiwan on december 4-8, is it going to be cold? or just so-so? which jacket is the best to bring? puffy, sherpa, cardigan or windbreaker? advance thank you to those who will answer :)",https://www.reddit.com/r/taiwan/comments/1fzrcrw/weather_in_taiwan_on_december/,self.taiwan,2024-10-09 14:25:31,Original-Gap3102,2024-10-09
665,Buying iPhone 16 in Costco ,"Compared to apple stores and other resellers, Costco's iPhones are cheaper.I'm planning to get one soon so should I know anything before buying?Do Taiwanese people usually buy iPhones in Costco?",https://www.reddit.com/r/taiwan/comments/1fzpyga/buying_iphone_16_in_costco/,self.taiwan,2024-10-09 13:14:31,EmploymentWhole1544,2024-10-09
666,How do I make a good impression on my host family?,"So I'm about to fly to Taiwan in a month for an exchange program. I've never done anything like this before, so I have no idea how it's gonna go down. I'll be staying with a host family, and I'll be the most respectful and polite guy as expected, but what else would you guys recommend for me to really not piss my host family off? I come from the Philippines, where being polite and courteous to your elders and your hosts is the norm, but maybe there are other stuff Taiwanese families appreciate? Thanks in advance!",https://www.reddit.com/r/taiwan/comments/1fzonb3/how_do_i_make_a_good_impression_on_my_host_family/,self.taiwan,2024-10-09 11:57:14,OrangeSheepYT,2024-10-09
667,Gaming/work cafes to bring my laptop to? ,"Hi I've heard of the Nvidia-certified gaming cafe and Qtime, but me and my partner don't need to use any machines because we have gaming laptops. I'd like to download some more video games and also play on my laptop with fast internet. Doesn't need to be a private room, public is fine. Good chairs/ergo options are a plus, not a huge necessity. Longer opening hours the better. ""Cafes"" are great too. **#1 priority is simply super fast internet for downloading games before my next travels.** Any recommendations? ",https://www.reddit.com/r/taiwan/comments/1fzo9lc/gamingwork_cafes_to_bring_my_laptop_to/,self.taiwan,2024-10-09 11:31:58,SettingIntentions,2024-10-09
668,Receiving Amazon packages ,I ordered some stuff from Amazon and it came earlier than expected and of course it came while I wasn’t home. (I know because I got an email saying attempted delivery). So I made sure I was home all day the next two days and they didn’t come again. I don’t live in a building with a door man. And I can’t be home all day everyday waiting. What do I do? What happens if I miss the delivery? ,https://www.reddit.com/r/taiwan/comments/1fzo8ut/receiving_amazon_packages/,self.taiwan,2024-10-09 11:30:26,WheelComprehensive29,2024-10-09
669,KTV themed cab,,https://www.reddit.com/gallery/1fznqlv,reddit.com,2024-10-09 10:55:04,HeyImGabriel,2024-10-09
670,Where to buy Climbing shoes? (la sportiva / scarpa / tenaya),"Hi. I'm going to Taipei in January. I'm aware T-UP sells climbing shoes, but I can't see what kinds or brands. Does anyone know if they sell La Sportiva / Scarpa / Tenaya shoes?

Also, does Ting San Lou Mountain Equipment have them too?

I would appreciate the answers. Please help us hunt our first pair of shoes. 😊",https://www.reddit.com/r/taiwan/comments/1fzneav/where_to_buy_climbing_shoes_la_sportiva_scarpa/,self.taiwan,2024-10-09 10:29:48,heisenbourgeois,2024-10-09
671,Looking for Salad bar/ Salad Restaurant in Taipei/New Taipei,"Hello everyone, I'm an American currently living in New Taipei. I was wondering if anyone had Salad bar recommendations. I'm missing the classic big salad with chicken and ranch. If anyone can help me, I'd be grateful.",https://www.reddit.com/r/taiwan/comments/1fzm88y/looking_for_salad_bar_salad_restaurant_in/,self.taiwan,2024-10-09 08:55:42,Background_Such,2024-10-09
672,Shaved Ice,"I miss the shaved ice from Taiwan when I went to visit my family and I want to try and make some at home! It’s always been one of my favorites for the humidity and sunny weather.

I was wondering if anyone has any shaved ice machine recommendations online that I could order or anywhere in store! 

I usually keep it simple with tapioca and fruit or grass jelly, but if anyone has any other topping ideas authentic to Taiwan, I’m always happy to try more. I was also curious if anyone knows of good brown sugar syrup to put on the ice or again any other flavors! ",https://www.reddit.com/r/taiwan/comments/1fzki50/shaved_ice/,self.taiwan,2024-10-09 06:44:07,scubagirll,2024-10-09
673,"Lost passport, don't have required documents for replacement","I can't find my Taiwanese passport so I looked at [https://www.roc-taiwan.org/ussfo\_en/post/3938.html](https://www.roc-taiwan.org/ussfo_en/post/3938.html) for how to get a replacement. I don't have a ROC national I.D.,  Household Registrations Transcript issued within 3 months, or a certificate of ROC nationality so I'm not sure how I would apply for a replacement in America. Can I enter Taiwan with my US passport then try and get a replacement while I'm in Taiwan(my parents can help me get the required documents while I'm there)? I had the 僑居證明 on my lost passport, if that makes any difference.",https://www.reddit.com/r/taiwan/comments/1fzkgkr/lost_passport_dont_have_required_documents_for/,self.taiwan,2024-10-09 06:41:00,gordan402,2024-10-09
674,Double Ten Day,Been living in taipei for 3 months now and my friends say that every October 10 taiwan national day is that most stores have big discount or sale. I'm looking for shoes and hobby stores (e.g. anime stuffs) that is on sale in october 10.  Do y'all have some places to recommend?,https://www.reddit.com/r/taiwan/comments/1fzk9tk/double_ten_day/,self.taiwan,2024-10-09 06:27:55,Longjumping-Touch717,2024-10-09
675,What are some culture shocks in Taiwan?,"I’ve been living in Taiwan for a while now, and I’m curious to hear about the culture shocks others have experienced here. What were some surprising or challenging aspects of Taiwanese culture that you encountered when you first arrived?

Such as:

* Daily life and social norms
* Food and dining etiquette
* Language barriers
* Public transportation
* Any other unexpected differences",https://www.reddit.com/r/taiwan/comments/1fzjrzg/what_are_some_culture_shocks_in_taiwan/,self.taiwan,2024-10-09 05:54:54,[deleted],2024-10-09
676,MRT etiquette: handles,"What’s your take on people who hold two handles (making a ‘V’ shape) on the MRT? Of course, if it’s crowded and people need handles, it’s an obvious no-no. Assuming it isn’t crowded, is it in bad taste to do so?
",https://www.reddit.com/r/taiwan/comments/1fzix4o/mrt_etiquette_handles/,self.taiwan,2024-10-09 05:01:17,kkavalan,2024-10-09
677,Stray cats?,"Hello, all! I am visiting Taipei for the first time. Unfortunately I have a very big phobia of cats. Are there many stray cats in Taipei? Thank you in advance!",https://www.reddit.com/r/taiwan/comments/1fziruj/stray_cats/,self.taiwan,2024-10-09 04:52:18,Pitiful_Read_5335,2024-10-09
678,Winter in taipei,How cold is it in winter in Taipei? What are some fun activities or things to do during winter in Taipei?,https://www.reddit.com/r/taiwan/comments/1fzif4a/winter_in_taipei/,self.taiwan,2024-10-09 04:31:24,Longjumping-Touch717,2024-10-09
679,Patreon equivalent in Taiwan?,Is there a Patreon equivalent like site in Taiwan? I was wondering since more artists are going more digital. ,https://www.reddit.com/r/taiwan/comments/1fzhkif/patreon_equivalent_in_taiwan/,self.taiwan,2024-10-09 03:43:52,stillness0072,2024-10-09
