,title,selftext,url,domain,time,author,date
397,Film Photos from Jiufen,"After many visits to Jiufen when I used to live in Taiwan, it was so nice to finally stay overnight on our visit back earlier this year !",https://www.reddit.com/gallery/1g880ut,reddit.com,2024-10-20 21:19:36,phoebeefaye,2024-10-20
398,Are there any Shugo Chara merch in Taiwan?,"I am traveling to Taiwan in November and was wondering if anyone knew of places to get figures/gachas/merch etc of ""shugo chara"" or any other animes.  
I already have the Pokemon Center in Taipei on my list but I want merch from other animes as well. ",https://www.reddit.com/r/taiwan/comments/1g837ez/are_there_any_shugo_chara_merch_in_taiwan/,self.taiwan,2024-10-20 17:52:38,IntroductionPast3471,2024-10-20
399,Can i immigrate to Taiwan withouth a college degree?,"I currently live in Brazil and i'm willing to live in Taiwan a few years ago, i'm just about to finish high school and i didn't find any college which i fit, i'm not exactly interessed about the options yet, but i'm willling to work at the first job opportunity that i may get in Taiwan, i'm now working at a funeral parlor which in general i deal with customers it may helps with the work experience, i'm also studying Mandarim by myself in the moment so i'm avaible to put any efforts to be accepted and move to Taiwan, is there any possibility for i get a work there withouth a college degree? (i'm desesperated lol!)",https://www.reddit.com/r/taiwan/comments/1g82mal/can_i_immigrate_to_taiwan_withouth_a_college/,self.taiwan,2024-10-20 17:27:25,Sne_586,2024-10-20
400,Anyone bought second hand iPhone from Smart Mobile at Guanghua?,"According to this [thread](https://www.reddit.com/r/taiwan/comments/1fmm28k/comment/lobrtmh) the batteries are new, but do they replace with genuine iPhone batteries such that FaceID still works? I understand that they don't guarantee the same water- and dustproof protection as new phones.

Also, are those phones displayed in the shop actually those that they sell or is one expected to order from their website? ",https://www.reddit.com/r/taiwan/comments/1g82cr0/anyone_bought_second_hand_iphone_from_smart/,self.taiwan,2024-10-20 17:15:55,9F8212F12FC8449AA46,2024-10-20
401,"Weekly Travel, Questions, &amp; Mandarin Thread","This thread is for:

* Travel queries &amp; information.
* Generic questions that most likely won't generate discussion as their own thread.

That said, we're also trying to allow more discussion-based text threads, so hopefully this will help dilute the ""news flood"" that some users have reported.

*Use upvotes to let people know you appreciate their help &amp; feedback!*

Most questions have been asked on this sub. You will find great resources by using the search function and also by using Google. To prevent the sub from being continually flooded with itinerary requests or questions about where to find [random object], please post questions and requests here.
___
本文為以下議題開設：

* 旅行相關問題與資訊分享。
* 不需要另外開設討論區的通用性問題。

*歡迎大家點擊“讚”向其他人傳達你的感激與回饋！*

儘管是使用中文討論，煩請遵守Reddit本站與討論區規則。
___
**This thread's default sort is NEW.**

**This thread will change on the first of every month.**",https://www.reddit.com/r/taiwan/comments/1g81zg3/weekly_travel_questions_mandarin_thread/,self.taiwan,2024-10-20 17:00:24,AutoModerator,2024-10-20
402,Where to find best steak tartare in Taipei? ,"Hey looking for some good steak tartare, never really saw a place where I can get that. Morton’s for example doesn’t seem to have it on the menu! Would really appreciate some good recommendations!",https://www.reddit.com/r/taiwan/comments/1g81b3g/where_to_find_best_steak_tartare_in_taipei/,self.taiwan,2024-10-20 16:29:57,alexkoas,2024-10-20
403,Ex-president Tsai urges Taiwanese to tell world 'Taiwan matters' - Focus Taiwan,,https://focustaiwan.tw/politics/202410200011,focustaiwan.tw,2024-10-20 16:02:33,thestudiomaster,2024-10-20
404,Looking for shops that sell airsoft,"Hi, i’m currently staying near Taipei main station. Can anyone point me to a big airsoft shop. Thanks. 
Ben",https://www.reddit.com/r/taiwan/comments/1g80bt4/looking_for_shops_that_sell_airsoft/,self.taiwan,2024-10-20 15:45:59,Sea-Seaweed3728,2024-10-20
405,Harvard punishes Taiwanese student for disrupting Chinese ambassador,"[https://www.taiwannews.com.tw/news/5954501](https://www.taiwannews.com.tw/news/5954501)

A Taiwanese student was physically assaulted by a chinese student for protesting the CCP, then wrongfully punished. We Taiwanese are fed up. Not only do we face harassment from china in our own country, we are forced to deal with chinese harassment overseas as well. Enough is enough. I call on the world's free democratic countries to send chinese students back to china where they belong. There is no room for authoritarian communist sympathizers in liberal societies like America or Taiwan.",https://www.reddit.com/r/taiwan/comments/1g7yoqh/harvard_punishes_taiwanese_student_for_disrupting/,self.taiwan,2024-10-20 14:27:26,Southern_Rip_5801,2024-10-20
406,Beautiful Taiwan,"Some pictures of my trip in August 2024
Taipei —&gt; Kenting —&gt; Kaohsiung —&gt; Tainan —&gt; Chiayi —&gt; Taichung —&gt; Alishan —&gt; Penghu islands —&gt; Hsinchu
 ",https://www.reddit.com/gallery/1g7wabj,reddit.com,2024-10-20 12:09:03,gring0w,2024-10-20
407,What to say when …,I want to know what people here say when they want to take a package from convenience stores. I’m a foreigner and sometimes they don’t understand what I want when I said I want to take a package. Please help.,https://www.reddit.com/r/taiwan/comments/1g7v3y1/what_to_say_when/,self.taiwan,2024-10-20 10:45:00,NoAfternoon7185,2024-10-20
408,Some night photos around Taiwan.,"Some shots on my Fujifilm x100v, shot raw with glimmerdust filter and edited with my own preset. Hope you guys enjoy!

IG: @justbrianwu",https://www.reddit.com/gallery/1g7tg0q,reddit.com,2024-10-20 08:36:12,justbrianwu,2024-10-20
409,CAP test help ,"Hello,
My niece is in her first year of senior high-school in Taiwan and I want to help her with her studies for the CAP exams. In the UK you can often find exam papers from previous years and use them to help you study. Is that possible with the Taiwanese CAP tests. Specifically the English, and Maths ones, but honestly any. I tried to look myself but my lack of mandarin has not helped. Any advice or links to old papers is much appreciated. FYI I'm British and in the UK but we talk to my niece every weekend. ",https://www.reddit.com/r/taiwan/comments/1g7uitl/cap_test_help/,self.taiwan,2024-10-20 10:00:07,Potential_Package_62,2024-10-20
410,"Moving to Taipei, what's the best approach to learn how to speak Mandarin ? ","Hi there ! 

I'm moving to Taipei next year and am not sure where to start learning Mandarin, I'm a total beginner. My emphasis is on speaking and reading, I don't think I should spend too much time learning how to write. 

My initial research hasn't been very successful. The main options I found are : 

* NTNU : big focus on writing
* Taipei Languauge Institute : very mixed reviews

Any advice on how I should start this exciting journey ? 

Thanks !",https://www.reddit.com/r/taiwan/comments/1g7uhiq/moving_to_taipei_whats_the_best_approach_to_learn/,self.taiwan,2024-10-20 09:57:12,SnooStrawberries4424,2024-10-20
411,South Africa asks Taiwan to move embassy out of capital,,https://www.dw.com/en/south-africa-asks-taiwan-to-move-embassy-out-of-capital/a-70539211,dw.com,2024-10-20 07:04:20,thestudiomaster,2024-10-20
412,Resources on starting and running a business,"Hi everyone,
I am coming to Taiwan in February for my exchange studies. It will be my first time in Asia and as my major is international business &amp; entrepreneurship, I want to ask if you have any good resources on setting up and running a business in Taiwan 😊
It's just a general area of interest for me and as I've lived in multiple countries, I tend to compare and contrast the different environments and systems for running a business.  ",https://www.reddit.com/r/taiwan/comments/1g7rruw/resources_on_starting_and_running_a_business/,self.taiwan,2024-10-20 06:33:10,Lost_Albatross_5673,2024-10-20
413,Travelling to Taiwan during Labor day 2025,"Hello, would like to check if it is advisable to travel to Taiwan during Labour Day ?",https://www.reddit.com/r/taiwan/comments/1g7rbyy/travelling_to_taiwan_during_labor_day_2025/,self.taiwan,2024-10-20 06:02:06,Dry-Excitement-884,2024-10-20
414,My sister told me I became a ‘willing prey’,"Last week I was strolling through a park in Taipei when a local man stopped me. He asked if I could help with his project, assuring me it would only take a short time. As everyone I’d encountered in the city had been so friendly, my usual caution went away. My mind automatically assumed it was for some university assignment, so I agreed. 

At first, the instructions seemed harmless. He had me walk, make small hops, and move in circles. It felt almost playful, but then he asked to film my feet. That’s when a sense of unease began to settle in. I foolishly brushed it aside, convincing myself it was still part of the project.

My sister told me I became a willing prey. Now that it’s all over, I do agree and can’t shake the feeling that I might have become a willing participant in something I didn’t fully grasp. The thought of being involved with someone who may have had a foot fetish makes me uncomfortable. It’s unsettling to think I completely let my guard down but maybe it’s because this place felt so welcoming. I am also mad at myself for not even asking for his portfolio in the first place. Now I’m left wondering what to do with this strange experience. I guess I’m gonna have to tap into my vigilant self honed by my experiences living in a third world country. ",https://www.reddit.com/r/taiwan/comments/1g7qvgj/my_sister_told_me_i_became_a_willing_prey/,self.taiwan,2024-10-20 05:31:09,[deleted],2024-10-20
415,雨夜花 - EVA air landing music,"1. So to those who are familiar with Eva air they play this song on landing. But the track is a Chinese flute. The version you can find on YouTube usually is orchestral, does anyone know where I can get a original copy of the one with Chinese flute?

2. Is it just me or does this song just hit you in the heart on landing (and I do mean like a spear)? My flight is 14 hours, it’s so touching and otherworldly but also so familiar. I almost feel like flights landing in Taiwan should be required to play it because it’s such a “cultural boon” of a tune. United’s landing music has nothing on this song’s motherly tone, desperate to hug you home.

Funny thing I’m not even Taiwanese lol but I am a “本國人” now.

Taiwan the “heart of Asia”, and you wouldn’t know because it’s far too neglected to ever be “seen” (not Thailand) too humble to force the issue, and the world ready to let it be forsaken; except for the silicon. Taiwan a blooming flower, clouds to the west, pray for more sunlight. Stay attached to the branch. 祝福您們


For those unfamiliar, the song itself was created in Taiwan during the Japanese occupation period originally a children’s song, then later changed to have words related to a very sad story about a woman (it’s long you can look at the wiki) but more impressive the song was later adapted in world war 2 to be a wartime song for the Japanese war effort, then later when the ROC government came to Taiwan the song was banned from being played or sung during martial law period. ",https://www.reddit.com/r/taiwan/comments/1g7qm8d/雨夜花_eva_air_landing_music/,self.taiwan,2024-10-20 05:14:19,Appropriate_Name_371,2024-10-20
416,What do the Taiwanese think of Shinzo Abe?,"I'm curious to hear what Shinzo Abe's legacy is in Taiwan. What did people think of him while he was Prime Minister and even after he stepped down: what was the reaction to his death in 2022?

I know a bronze statue of him exists in a memorial park in Taiwan, which makes it seem he was an important leader for the Taiwanese as well as the Japanese. 

Is he a figure that is still thought of or talked about in different circles in Taiwan? If so, what kind of figure has he become and how do people talk about him?",https://www.reddit.com/r/taiwan/comments/1g7q4n7/what_do_the_taiwanese_think_of_shinzo_abe/,self.taiwan,2024-10-20 04:44:15,timt97,2024-10-20
417,Food Allergy/Intolerance ,"Hi everyone!  I will be visiting Taiwan for the first time soon and am very excited!  I have a food intolerance (called G6PD deficiency) which prevents me from eating fava(broad) beans.  Because of this, I have the idea of printing a card with the following text (with chatGPT’s help) that I can show at restaurants, as I don‘t really speak Mandarin:

“我不能吃蠶豆或胡豆，包括豆瓣醬，因為我對這些食物嚴重過敏。請確保我的食物中沒有蠶豆或胡豆，謝謝。”

Should this be enough?   Perhaps any others in this position who have any recs./suggestions ?Thank you!!
",https://www.reddit.com/r/taiwan/comments/1g7o0mo/food_allergyintolerance/,self.taiwan,2024-10-20 02:39:13,Distinct_Meaning_577,2024-10-20
418,How desillusioned am I to think about moving to Taiwan ? My profile ,"Hello fellow redditors, 

Could you please tell me what arey chances of finding a job for 3months or longer in Taiwan? 

My profile 
- around 25 male, brown skin 
- master's degree in public affairs
- eu-native, mother tongues from 2 big European countries, used English as a working language, mandarin around HSK5 (普通话 though, right now I struggle with traditional characters) 
- few professional experiences: lots of unemployement, internships in civil society organizations in the European Union and start-ups in Beijing


A few questions please 
- how realistic is it to find a job in Taiwan linked to sustainability and/or public affairs/policy ? How much time would I need to find such a job if I am already in Taiwan versus if I am searching from abroad ? 
- same question than above, but now with whatever job is able to pay my bills and ideally slave 250 euros a month ? I would be okay with washing dishes or helping companies grab EU market shares
- Working holiday visa seemed a good idea at first glance, but does not seem popular on this reddit hahaha why? Would a company not be able to easily hire me if I already have a work visa? 
- how much savings would I need before I find a job which covers my bills ? 

My goal is simply to improve my mandarin and avoid any debts ! I am flexible regarding location and very adaptable to new environments

Lots of people have been recommended to teach English, but I guess it won't be an option for me since I am not from an English native country and not white enough and... I don't mind, if would actually prefer a job where I can avoid foreigners to actively practice mandarin 


Any other tips are also super welcome, thanks a lot ! 


Thanks a lot ! 


Edit : the working holiday visa of my country allows to work up to a year in the same organization ",https://www.reddit.com/r/taiwan/comments/1g7nbcp/how_desillusioned_am_i_to_think_about_moving_to/,self.taiwan,2024-10-20 01:59:40,Thin_Conversation451,2024-10-20
419,Taipei weather this week,"I'm scheduled to arrive in Taipei on Thursday and will be there for 6 days. Looking at the weather forecast, it looks like heavy rain is likely for the next week or more. Is that kind of rain likely to lead to flooding? If the weather is really going to bad, I might want to change my schedule.

Can somebody who's in Taipei give me some idea of what I should expect?",https://www.reddit.com/r/taiwan/comments/1g7lzvu/taipei_weather_this_week/,self.taiwan,2024-10-20 00:48:39,Woody_L,2024-10-20
420,Why can’t I buy Po Chai pills / Bao Ji Wan in Taiwan?,"So I really need po chai pills on my trip home (here) but to my surprise multiple pharmacies and Chinese medicines stores told me

Bao Ji Wan is not available in Taiwan. Basically without any reason either. I asked them why? And they kinda just said not to ask , and go to Hong Kong for it.

But why? It’s Chinese medicine after all and the most famous brand of it.

It’s weird , I’ve bought it in every Asian country I’ve been to so far (even Philippines) and Japan. 

So anyone know where I can get it in Taiwan? ",https://www.reddit.com/r/taiwan/comments/1g7chgy/why_cant_i_buy_po_chai_pills_bao_ji_wan_in_taiwan/,self.taiwan,2024-10-19 17:19:16,transazngirl,2024-10-19
421,"Art, Raves, Culture Events November ","Hi all, 

Travelling to Taipei for my birthday next month, super excited. Would you happen to have any recommendations of websites where I can find local events? I'm into local craft markets, jazz bars, techno, art workshops, pop ups, and things that are usually 'one off' events, quite difficult to find if you don't know the 'cool' people from the city you're visiting. \*It would be much appreciated if anyone can recommend some cool influencers to follow on ig so I can start looking. 

Thanks very much! ",https://www.reddit.com/r/taiwan/comments/1g7arab/art_raves_culture_events_november/,self.taiwan,2024-10-19 16:00:09,sagemattel,2024-10-19
422,抽驗,Okay so I occasionally smoke and I have been in Taiwan for two months now… What do people do with their cigarette butts? I feel like a despicable human being if I just toss it on the street. My friend said I should keep them and throw them away at home but I don’t want my apartment to smell like cigarettes (I have roommates who don’t smoke) What is the best/ most respectful way to deal with this??,https://www.reddit.com/r/taiwan/comments/1g78xjb/抽驗/,self.taiwan,2024-10-19 14:28:35,becausetumblrisdead,2024-10-19
423,Kanakanavu Language,https://www.reddit.com/r/endangeredlanguages/comments/1g46hwj/kanakanabu_language_the_least_spoken_austronesian/,https://www.reddit.com/r/taiwan/comments/1g7874o/kanakanavu_language/,self.taiwan,2024-10-19 13:51:24,Different_Method_191,2024-10-19
424,Buying a nice Go set in Taiwan,"Anyone know where I could buy a very nice Go set in Taiwan? Preferably something unique or handmade. I'm a hobby board gamer and it's the one big ticket item I want to bring home while living here. 

EDIT: also interested in a mahjong one, but that's lower priority. ",https://www.reddit.com/r/taiwan/comments/1g785ao/buying_a_nice_go_set_in_taiwan/,self.taiwan,2024-10-19 13:49:00,Ap_Sona_Bot,2024-10-19
425,Short Change Ripoff in Taiwan. Not.,"I've lived in Taiwan for 34 years now, and have had thousands of transactions. Been both short-, and long-changed. A few dozen times each. And I always straighten things out as soon as I notice, no matter which. We're all human here; mistakes get made, but in general, Taiwanese people strike me as VERY honest. 

I've been ripped off deliberately twice. Once by a woman selling fragrant flowers at the stop light. I wanted one garland, but she pretended I wanted two and made change appropriately. So I got fucked for one garland. Probably NT$20. I was furious of course. So I struck back. Never bought from those ladies again, canceling thousands of NT$ worth of sales over the years. I really hurt em! 

And I got ripped once by a taxi. He failed to start the meter. I knew how much that trip should cost, but he overcharged.  Total rip off amount (flowers plus taxi) comes to about NT$60. About NT$ 0.005 per day, on average.

Up until this year, honest errors were about evenly divided—half in my favor and half in my disfavor, which makes me think they are honest errors. If they were all against me, I'd have a less pleasant opinion.

But about a month ago there was a bigger error. I bought a scroll saw from a Taiwan vendor, online, COD. Total cost NT$5410. Saw was delivered promptly through the mail, but no one collected. Free saw! I contacted the seller and asked for ATM payment details. Vendor replied with details, and thanked me for my honesty. 

He also said since I was so honest, I could knock NT$10 off the total. Which I did. So I now have a dollar value assigned to my honesty: NT$10, which is 32¢. Good to know. Anyway, this NT$5400 error in my favor has thrown my mental balance sheet off and the Taiwanese are now ***way ahead.***",https://www.reddit.com/r/taiwan/comments/1g76m6y/short_change_ripoff_in_taiwan_not/,self.taiwan,2024-10-19 12:13:45,wheezer72,2024-10-19
426,American Taiwan Baby looking for Music	,"My daughter loves the baby tiger cartoon series here 巧虎TV（台灣巧連智官方頻道）https://youtu.be/WCDE3khHRbw?feature=shared  but we don’t want her watching the videos, just listening to the lady and tiger sing and dance, does anyone know where I can find a music album of the songs here in America?  We have a YouTube playlist, but are these on other place like Apple Music or Spotify?  I don’t speak the language but I’m trying to surprise my wife with a playlist or album or something.  Trying to find the stuff for Taiwan, I found lots of stuff that’s from China/mainland on Apple Music but it sounds like a different dialect. ",https://www.reddit.com/r/taiwan/comments/1g76jf7/american_taiwan_baby_looking_for_music/,self.taiwan,2024-10-19 12:08:21,According_Physics624,2024-10-19
427,Help! CPC withdrew 5.5k NT$ for a scooter refuel,"Dear Community,
We’re travelling in Taiwan for 2 weeks and are currently in Tainan. We rented a scooter which we needed to refuel. On the self-service terminal we chose to pay by physical credit card. Once we refuelled for 85 NT$ we put the nozzle back and the card popped out. 
10 minutes later the account shows a withdrawal of 5.500 NT€ and we have no idea why. 
Does any of you have an idea why is this and how to solve this?",https://www.reddit.com/r/taiwan/comments/1g75xbm/help_cpc_withdrew_55k_nt_for_a_scooter_refuel/,self.taiwan,2024-10-19 11:23:36,TheNickest,2024-10-19
428,Taiwanese Language Exchange Scam,I'm currently studying abroad in Taiwan and I have been approached by older men on a weekly basis asking to be language exchange partners. Usually by strangers on the street even while wearing clunky over the ear headphones. I was warned by my school that this is a scam/unsafe and can result and harassment and stalking. I was wondering if this is something that happens to all women in Taiwan or are they targeting me because I am a foreigner? Is it normal for Taiwanese men to approach women they don't know and ask for their number? What do they think to gain for asking a random person for language exchange? Any insight to this topic would be appreciated. ,https://www.reddit.com/r/taiwan/comments/1g73ubo/taiwanese_language_exchange_scam/,self.taiwan,2024-10-19 08:41:27,Willing_Help_9992,2024-10-19
429,U bike charges?,"How does the charges for the Ubike work? One of my friends told me that it is free for the first 30 minutes with the easy card. But sometimes when I use it it charges me 5$ and I don't ride it more than 10 minutes, I avoid the orange one and just use the regular ones. Anyone knows how does the fare system works? ",https://www.reddit.com/r/taiwan/comments/1g722rk/u_bike_charges/,self.taiwan,2024-10-19 06:31:43,ateyourgrandmaa,2024-10-19
430,Cathay United Easycard?,"Hello all,

I opened up my Cathay united account a few days ago. It was a painful experience!! They gave me the easycard debit card and sort of mentioned auto top ups. But that feature isn’t working. Anyone know how to activate this? 

Thank you ",https://www.reddit.com/r/taiwan/comments/1g70u5c/cathay_united_easycard/,self.taiwan,2024-10-19 05:10:42,Molboro87,2024-10-19
431,Are there any airlines from Taiwan to Korea with low baggage fees?,"I'll be going home to the US in December from Taiwan, but am considering staying a few days in Seoul, because the cost of flying to and from there is about the same and flying directly from Taiwan (and to be a tourist for a few days!)

However, they are typically local/budget airlines, and I'll have one large check-in bag, a carry on rolling bag and a backpack. I'm wondering if there are any airilines that won't charge too much for baggage fees?",https://www.reddit.com/r/taiwan/comments/1g70quz/are_there_any_airlines_from_taiwan_to_korea_with/,self.taiwan,2024-10-19 05:05:07,Hot-Strawberry-6658,2024-10-19
432,Is Mt Qixing Xiaoyoukeng Trail Temporarily Closed??,"Hi everyone, I would like to fact check with anyone who has recently hiked at Yang Ming Shan if Mt. Qixing Xiaoyoukeng Trail is temporarily closed, and if the Mt. Qixing main peak is also closed? We are planning to hike this route on 31st October. Thank you for the replies in advance!",https://www.reddit.com/r/taiwan/comments/1g70guh/is_mt_qixing_xiaoyoukeng_trail_temporarily_closed/,self.taiwan,2024-10-19 04:48:20,LostConstruction6645,2024-10-19
