,title,selftext,url,domain,time,author,date
192,**TYPHOON KONG-REY** Update Thread,"First, it's important to know that typhoons can be something or nothing. Don't freak out about them; just be cautious and up-to-date.

The periphery of Typhoon Kong-Rey will likely make an impact on Taiwan starting Wednesday. It's on track to make landfall as a typhoon in eastern Taiwan in either Hualien or Taitung county on Thursday. Weather will probably be the worst on Thursday and Friday.

# General info

* **Name:** Kong-Rey (Leon)
* **Status:** [SEA AND LAND WARNING ](https://www.cwa.gov.tw/V8/E/P/Typhoon/TY_WARN.html)
* **Current Category:** Tropical Storm
* ^(- Definitions for Category:) [^(Saffir-Simpson Hurricane Wind Scale)](https://www.nhc.noaa.gov/aboutsshws.php)
* **Risks:** High Winds, Dangerous Seas, Potential for Flooding &amp; Landslides
* **Cancelations:** 

^(See DGPA's website for updates:) [^(English)](https://www.dgpa.gov.tw/typh/daily/ndse.html) ^(/) [^(中文)](https://www.dgpa.gov.tw/typh/daily/nds.html)

* **Transportation:**

# Advisory

If you've never experienced one, basically:

* **Stay in doors when the typhoon hits.** The water and wind aren't necessarily dangerous by themselves, but when they start to affect rusty store signage and poorly affixed building tiles, object flying around can cause serious injury or death. Make sure to stay in covered walkways if you do have to go out.
* **Do NOT go to the** riverside or any parks, or beaches/coasts. There's a huge chance of danger especially when water becomes unpredictable. ***Especially*** ***do not*** **go to the beach or into the water**. People die every year because they underestimate the power of typhoons on the oceans and overestimate their abilities to deal with nature.
* In this vein, **bring anything you don't want to fly away inside**. Scooters fly away, so your plants, bicycles, etc., may as well.
* **Prepare water, food, and other potential necessities.** Regardless of where you are in Taiwan, always be aware of your surroundings and alert to the dangers of the typhoon. Typhoons can cause flooding, which disrupts water supplies. Your water may be shut off, so you may want to collect water in your tub or other containers for flushing toilets and/or washing.
* **You may lose electricity.** Make sure your phone is charged and try to reduce the amount of perishable foods in your refrigerator. A portable battery pack is nice for keeping your phone charged during things such as this. If you *really* need power, you may invest in a [UPS](http://www.newegg.com/UPS/SubCategory/ID-72).
* ***Do not*** **go hiking and try to stay out of the mountains** if it isn't absolutely necessary (i.e., you live there). Land slides are a real threat during typhoons. Also hiking in the **days following a typhoon** may also be dangerous since the ground still isn't fully settled and might be prone to landslides. Because of a typhoon all national parks (Yushan, Shei-pa, and Taroko) will close the hiking trails immediately. All permits are canceled too.
* If you have a windows, **stay away from them as much as possible** and maybe even **place something below them for potentially broken glass**.
* ***Do not*** **tape your windows**. It doesn't help and can actually make 1) potential flying shards more dangerous and 2) clean-up more difficult.
* **Potential for disruptions to transportation**. Roads can become impassible and disruptions to public transportation (buses, HSR, etc.) can occur due to flooding. If you plan on flying, it is highly advised that you keep an eye on your flight and check with airlines.
* **Residences can take on water even above flood lines**. Check all drains from outside for obstructions multiple times throughout the typhoon (if possibly done without danger).

Links

* (En) [Typhoon2000](http://www.typhoon2000.ph/)
* (En) [Tropical Tidbits](https://www.tropicaltidbits.com/storminfo/#23W)
* (En) [Weather Nerds](https://www.weathernerds.org/tc_guidance/WP23.html)
* (En) [Weather Underground](https://www.wunderground.com/hurricane/western-pacific/2024/typhoon-kong-rey)
* (En) [Taiwan Central Weather Bureau - Typhoons](https://www.cwa.gov.tw/V8/E/P/Typhoon/TY_NEWS.html)
* (中文) [Taiwan Central Weather Bureau - Typhoons](https://www.cwa.gov.tw/V8/C/)
* (En) [Japan Meteorological Agency](http://www.jma.go.jp/en/typh/)
* [Twitter Posts about Typhoon Kong-Rey](https://twitter.com/search?q=Kongrey)",https://www.reddit.com/r/taiwan/comments/1gembi8/typhoon_kongrey_update_thread/,self.taiwan,2024-10-29 04:21:27,DarkLiberator,2024-10-29
193,Best place to get Sleep study done in Taichung,"Hello, any recommendation for sleep doctor / study in Taichung?",https://www.reddit.com/r/taiwan/comments/1gelia1/best_place_to_get_sleep_study_done_in_taichung/,self.taiwan,2024-10-29 03:34:38,Ok_Letterhead_2888,2024-10-29
194,Mingde Reservoir in Miaoli.,,https://i.redd.it/z822en4nplxd1.jpeg,i.redd.it,2024-10-29 01:50:16,Final_Company5973,2024-10-29
195,Cargo box,"I am looking at getting a top box, or cargo box for my car. Does anyone know of any laws for these kinds of boxes?",https://www.reddit.com/r/taiwan/comments/1gej605/cargo_box/,self.taiwan,2024-10-29 01:33:37,Feelgood11jw,2024-10-29
196,Scary news about Taiwanese medical oxygen supplies,"I just saw the news about a factory in Taichung that specializes in producing medical oxygen cylinders being exposed for filling cylinders meant for medical institutions with industrial oxygen and selling them to hundreds of hospitals. However, the report focuses more on the cost difference between the two types of oxygen rather than on the dangers to patients even though it could be fatal. What's worse is that the Taichung government didn’t even suspend their operations or fine them; they simply gave them time to conduct a recall... that’s pretty crazy!!

I guess cheap national health insurance here comes at a price.

  
source: [https://www.youtube.com/watch?v=\_z3ETHwzZjI](https://www.youtube.com/watch?v=_z3ETHwzZjI)",https://www.reddit.com/r/taiwan/comments/1geiu57/scary_news_about_taiwanese_medical_oxygen_supplies/,self.taiwan,2024-10-29 01:17:21,Easy-Meringue1497,2024-10-29
197,Dentist Recs in Taipei,"Hi all, I was wondering if anyone has any recs for dentists in New Taipei/Taipei? I’ve been to probably 3 clinics by now… It’s getting a bit frustrating. The first one didn’t even know how to fill a cavity, and he messed up my tooth. The second one had absolutely zero idea what he was doing about anything, and the third one couldn’t even clean teeth properly.. I have NHI so I’d prefer a place that takes it. Should mention that I think my wisdom tooth is coming in, which is why I’m desperately looking for a good place. Although, I read some reddit posts that said NHI places are quite crappy even at cleanings. Hope someone knows a place. Really appreciate any recs! They don’t have to speak great Eng, my Mandarin is passable lol. TIA!",https://www.reddit.com/r/taiwan/comments/1gebbcc/dentist_recs_in_taipei/,self.taiwan,2024-10-28 19:48:19,surfoto,2024-10-28
198,Being an academics in Taiwan?,"I am graduating from my Ph.D. and looking for jobs now. I saw a few potential postings in Taiwan, but I really don't know much about the academia in Taiwan. Does anyone know how is it like? What's the teaching and research expectations? Anything special about the culture? I appreciate any inputs.",https://www.reddit.com/r/taiwan/comments/1geaeqn/being_an_academics_in_taiwan/,self.taiwan,2024-10-28 19:11:03,nimrod06,2024-10-28
199,How’s Chifeng Street on Sundays?,"Travelling to Taiwan for New Years, wondering if shops will likely be open on Sundays like the 29th of December.",https://www.reddit.com/r/taiwan/comments/1ge9k8t/hows_chifeng_street_on_sundays/,self.taiwan,2024-10-28 18:36:33,MuzanSama69,2024-10-28
200,Best coffee shop to study near taipei station,"Best coffee shop to study near taipei station (not necessarily in that same station but near at least)

I only know Louisa so far!!",https://www.reddit.com/r/taiwan/comments/1ge99li/best_coffee_shop_to_study_near_taipei_station/,self.taiwan,2024-10-28 18:24:45,OCD1238,2024-10-28
201,Best surf spots in Taiwan?,Also are they welcoming to Burmese (darker skinned Asians)?,https://www.reddit.com/r/taiwan/comments/1ge834u/best_surf_spots_in_taiwan/,self.taiwan,2024-10-28 17:37:01,PaytonAndHolyfield,2024-10-28
202,Iconic Place for a Photoshoot for family travel,"Will be traveling to Taiwan in 3 weeks' time. Would like to commemorate this trip with family by hiring a local photographer. Photoshoot will be around 1 h 30 min. Would you have any recommendations for the best value for time in terms of photos? This will be for a birthday as well. We were thinking at Shifen during the sky lantern, but it'll be on a Sunday and it's probably crowded. But we'd still like it because it's my family's first time there and when we look back, I feel like they will make for good memories. Any recommendations for an iconic place with lots of picturesque areas? Shoot will probably be in the afternoon, we don't want to look sweaty under the noontime weather hehe. 

  
Any recommendations for other local photographers as well? :) 

Thank you! ",https://www.reddit.com/r/taiwan/comments/1ge64e6/iconic_place_for_a_photoshoot_for_family_travel/,self.taiwan,2024-10-28 16:17:37,roadtofire1,2024-10-28
203,Shopee No Longer Lets You Browse From USA?,"So about a month ago I was able to browse listings without having an account. When I would create an account it would prompt me to use the app which is not available in the USA.

No no matter if I'm logged in or out it will just prompt me to use the app now. Any way around this? I want to browse listings if possible. Im aware I cannot purchase in the states",https://www.reddit.com/r/taiwan/comments/1ge3wt1/shopee_no_longer_lets_you_browse_from_usa/,self.taiwan,2024-10-28 14:49:15,zacknscreechin,2024-10-28
204,"Doomsday 'Tenement' video game launches in Taipei | Taiwan News | Oct. 21, 2024 18:38",,https://taiwannews.com.tw/news/5955702,taiwannews.com.tw,2024-10-28 13:21:40,radiantsilverlabs,2024-10-28
205,How to commute from Qingjing Farm to Sun Moon Lake? ,"Hi everyone, I’m going to Taiwan next month. 
I have not purchased a tour package and wahd to try doing it by myself for now because I want to learn how to commute in Taiwan. May I ask which bus I should ride from Qingjing Farm to Sun Moon Lake? You can also suggest other modes of transportation if any.

Thank you in advance.",https://www.reddit.com/r/taiwan/comments/1gdz1w8/how_to_commute_from_qingjing_farm_to_sun_moon_lake/,self.taiwan,2024-10-28 10:50:04,m0no-no-aware,2024-10-28
206,Yet another traffic rant,,https://i.redd.it/e7wou0wc3hxd1.jpeg,i.redd.it,2024-10-28 10:41:12,1ymooseduck,2024-10-28
207,Is Juifen and Shifen closed on Mondays?,"Hi everyone

My friends and I are planning to visit Taiwan this December. And one of our target place to visit is Juifen and Shifen. We are just wondering if they closed during Mondays? We plan to visit them on Mondays, assuming there will be less people. 

Thanks!
",https://www.reddit.com/r/taiwan/comments/1gdyjwk/is_juifen_and_shifen_closed_on_mondays/,self.taiwan,2024-10-28 10:16:13,adjuvan17,2024-10-28
208,"MOFA thanks EU, US, SK, Japan for supporting cross-strait peace - Taiwan Today",,"https://taiwantoday.tw/news.php?unit=2,6,10,15,18&amp;post=260798",taiwantoday.tw,2024-10-28 09:04:03,Right-Influence617,2024-10-28
209,Looking for vegan restaurant/options suggestions in Taipei. ,"Hi everyone, I would love to hear some of your restaurant recommendations for vegans. There are SO many options it’s a bit overwhelming. Only here for 4 days but want to try as much as we can. 

I’m interested in cheap local spots as well as expensive Michelin restaurants. 

A few Michelin star/rated ones I’ve found are Mipon and Serenity, that have vegan options. 

What are your favorites? 


Also, are there any places open in the morning? Trying to eat some breakfast!",https://www.reddit.com/r/taiwan/comments/1gdwuwz/looking_for_vegan_restaurantoptions_suggestions/,self.taiwan,2024-10-28 08:07:23,jaredj92,2024-10-28
210,Typhoon advice for a foreigner?,"EDIT: Thank you everyone for your super helpful advice, we managed to push our accom back two days so we will chill in Taipei until it passes! 

Hi everyone, myself and my partner are here visiting  Taiwan for 3 weeks from Australia. 

We have accomodation booked in the Donghe area near the Jinzun surf spot and looks like that’s where the typhoon is heading!! 

Our accomodation is non-refundable but we are wondering if it is too risky to go there during this time, is the area prone to flooding? 

P.S We have been travelling for the past 9 months and already this is one of our favourite places. We can’t believe how nice everyone is!! Thank you for being such welcoming people 🙏🏼

",https://www.reddit.com/r/taiwan/comments/1gdwqpf/typhoon_advice_for_a_foreigner/,self.taiwan,2024-10-28 07:58:29,Ok-Tangerine-4282,2024-10-28
211,Where can I buy this bicycle?,"I am looking to buy a KTM bicycle. Where can I buy one in Taiwan?

If not, perhaps KHS, Specialized, or Kona. What is a good bike shop that would allow me to order the model I need?

I am in Taoyuan.",https://www.reddit.com/r/taiwan/comments/1gdvolj/where_can_i_buy_this_bicycle/,self.taiwan,2024-10-28 06:33:56,EitherPin5217w,2024-10-28
212,Land warning for Tropical Storm Kong-Rey possible on Wednesday,,https://focustaiwan.tw/society/202410280007,focustaiwan.tw,2024-10-28 05:52:51,DarkLiberator,2024-10-28
213,Is it fair to consider myself taiwanese? ,"Hi all, was quite curious about what other people think about this (although I know it doesnt really matter). 

My great grandparents are 外省人 and left with CKS in 49. But in the mid sixties they moved to the US. My grandmother was born in China but grew up in Taipei until then. Many of her siblings were born there as well, so they all have very strong Taiwanese accents, use Taiwanese words/phrases and speak Taiwanese as well in addition to Mandarin. A lot of them also married Taiwanese later on. 

My mom was born in the US (her dad’s side left China during the 1920s) and speaks a little Taiwanese as well. However, I was wondering if its fair to call myself Taiwanese. The connection is kind of weak as they weren’t there for very long, but I was wondering if it would be fair. (My grandmother also is a citizen of the ROC although passport expired ages ago, but I can’t get it because pre-80’s citizenship was patrilineal :/). Thanks! ",https://www.reddit.com/r/taiwan/comments/1gdu6j4/is_it_fair_to_consider_myself_taiwanese/,self.taiwan,2024-10-28 04:46:36,Infinite_Koala9138,2024-10-28
214,Craft beer bars/breweries,"Greetings - I am coming to Taiwan for a leisurely 3 weeks, and am looking for recommendations for craft beer bars and breweries to try some of the local drops. I'll be visiting Taipei, Jiufen, Taitung, Kaohsiung, Tainan and Lukang at various points of my trip, and am willing to get adventurous!

Any suggestions/recommendations welcomed.",https://www.reddit.com/r/taiwan/comments/1gdtk2q/craft_beer_barsbreweries/,self.taiwan,2024-10-28 04:06:29,Dramatic_Grape5445,2024-10-28
215,Navigating Taiwan with little to no Chinese ,I'm thinking about going to ntnu mtc to learn Chinese but I'm on the fence about it since I'm wondering how I would manage the first few weeks with little to no chinese knowledge. I'm mainly worried/ stressed about getting around the city. I'm also wondering is getting from taoyuan airport to taipei main station complicated? Will not knowing much chinese make getting from place to place difficult? I tend to overthink/stress a lot of things on like this whenever I travel internationally so any comments/ suggestions will be greatly appreciated!,https://www.reddit.com/r/taiwan/comments/1gdrwqx/navigating_taiwan_with_little_to_no_chinese/,self.taiwan,2024-10-28 02:32:12,forsakenseasaw,2024-10-28
216,Demarcus Cousins Taiwan Beer Leopards Jersey?,Sorry if this is a dumb American question but I’m looking for a Demarcus Cousins Leopards jersey and I’m having trouble online. They just won the Taiwan league and he was FMVP so I’m guessing there’s got to be merchandise somewhere. Maybe it’s just not on English webpages? Idk but would love to get my hands on one. ,https://www.reddit.com/r/taiwan/comments/1gdrcu3/demarcus_cousins_taiwan_beer_leopards_jersey/,self.taiwan,2024-10-28 02:02:31,KeefsBurner,2024-10-28
217,Ice cream spots in Taipei,"Any got some recommendation for spots in Taipei to get some great ice cream? Open to try any kind!

I've got one I will visit called: 阿忠花生捲冰淇淋 新莊店 but want to see what else if out there.",https://www.reddit.com/r/taiwan/comments/1gdq7gv/ice_cream_spots_in_taipei/,self.taiwan,2024-10-28 01:01:22,stickyfinga,2024-10-28
218,taipei cafés,"what coffee shops do you recommend around taipei and what made you like them? 

I’m on a hunt for coffee shops / matcha place to visit! so far, i haven’t had a satisfying matcha latte. if anyone happens to know a place that will be great! ",https://www.reddit.com/r/taiwan/comments/1gdeb5c/taipei_cafés/,self.taiwan,2024-10-27 16:03:40,m1nt_ch0co,2024-10-27
219,"To all conscripts as well as career soldiers, how has your engagement with the PWB been and is this organization as active as the Political Commissars in the PLA?",,https://i.redd.it/uv8micj06dxd1.png,i.redd.it,2024-10-27 21:06:10,Tobias_Reaper_,2024-10-27
220,FREE AIRPORT TRANSFER,"Dear Traveler,
Round Taiwan Round invites you to take a quick 5-10 minute survey to help us enhance our services for all visitors. By completing the survey, you’ll have a chance to receive:

🎁 NT$200 Tripool discount voucher (for the first 30 respondents)
🚖 FREE single-trip airport transfer (for selected participants who join a follow-up interview)

👉 Survey link: https://tripool.typeform.com/to/jQMv1O3l",https://i.redd.it/q8xn5zc3k8xd1.jpeg,i.redd.it,2024-10-27 05:36:00,homieboiudoc,2024-10-27
221,Free Queen bed in hostel — female only 10/28-11/1/24,"Hi fellow travelers!

I had a change of plans. I won’t be able to stay at the hostel I booked. If you need board this is paid for otherwise it’ll go to waste. Bed-bunk is perfect!

Dates: 10/28-11/1/24 (mon- fri)

Location: Da’An, Taipei 
Metro: Dongmen station (right across the street)",https://www.reddit.com/gallery/1gd4cnz,reddit.com,2024-10-27 05:55:56,IndividualBroccoli74,2024-10-27
222,Chinese language classes at Taiwan universities ,For those who have progressed to the higher levels of Chinese language classes at univerities like NTNU and NTU what was the makeup of class like? How many people usually and where did most of your classmates come from? Anyone have any suggestions for NTNU vs NTU mandarin classes? Thanks.,https://www.reddit.com/r/taiwan/comments/1gdm6dh/chinese_language_classes_at_taiwan_universities/,self.taiwan,2024-10-27 21:47:28,Confident-Theory1310,2024-10-27
223,Advanced Chinese classes at language centers in universities ,For those who have progressed to the higher levels of Chinese language classes at univerities like NTNU and NTU what was the makeup of class like? How many people usually and where did most of your classmates come from? Anyone have any suggestions for NTNU vs NTU mandarin classes? Thanks. ,https://www.reddit.com/r/taiwan/comments/1gdm3wy/advanced_chinese_classes_at_language_centers_in/,self.taiwan,2024-10-27 21:44:09,Confident-Theory1310,2024-10-27
224,"best places to experience classical Chinese and Taiwanese music performances? (i.e. traditional non-western music, not necessarily western ""classical music"")","i realise i've lived in taiwan for two years now and i've still not found out where on the island one should go to experience 雅樂, 國樂團 and so on... i have a particular fondness for the sound of the 二胡.  does anyone have any recommendations for venues/troupes/shows etc? i live in Kaohsiung but i travel around a good deal.  thanks!",https://www.reddit.com/r/taiwan/comments/1gdlcn1/best_places_to_experience_classical_chinese_and/,self.taiwan,2024-10-27 21:09:21,tendernesses,2024-10-27
225,How easy ist Adoption as a gay Immigrant in Taiwan?,"I'm still far from living in Taiwan, but just out of curiosity from what I can expect of my dream, how hard ist Adoption as a gay Immigrant in Taiwan?

I know that in my Home country, Germany, it's pretty hard due to beurocracy and super high requirements. Hearing a lot about Taiwan being super open-minded, i thought it might be a realistic Thing to consider for the Future.

Thx!",https://www.reddit.com/r/taiwan/comments/1gdkrmo/how_easy_ist_adoption_as_a_gay_immigrant_in_taiwan/,self.taiwan,2024-10-27 20:43:26,Plastic_Ad4654,2024-10-27
226,Visiting during tropical storm Kong-rey,"Hey folks 

I am set to arrive in Taiwan on Thursday to meet up with family that arrived a couple of weeks ago. It looks like I’ll be arriving right as the storm hits Taipei (if my flight even leaves). 

Should I postpone a few days instead of spending a couple of days hunkered down from the storm? Does public transport usually shut down during these kinds of storms? I’m waiting until tomorrow to see how bad the predictions are and if I need to change plans. 

Thanks for the help ",https://www.reddit.com/r/taiwan/comments/1gdjl5e/visiting_during_tropical_storm_kongrey/,self.taiwan,2024-10-27 19:51:00,Tll6,2024-10-27
227,Freshly cut fruit (for tasting) in Taipei,"I'm in Taipei and would like to try out some fresh fruit of different sorts because people say it's awesome here. The trouble is, I'm a tourist with just a couple of days here left, so I don't want to buy a lot of them, just a bit of everything to try. Ideally the fruit would be cut up, so I can eat them then, or at the hotel (I don't have a knife here).

Could anyone please suggest some place where I could buy cut fruit in small quantities in Taipei? I'm staying in Ximen area.

Happy to pay a bit more. 

Essentially, what I'm looking for is either some seller who wouldn't look at me like I've lost my marbles if I ask for just ONE dragon fruit, ONE custard apple, etc, and would be okay to cut them for me. Or, alternatively, somewhere that sells pre-cut (but still fresh) fruit in small boxes. Just want to try a bit of everything. Hope that makes sense!",https://www.reddit.com/r/taiwan/comments/1gdh53r/freshly_cut_fruit_for_tasting_in_taipei/,self.taiwan,2024-10-27 18:05:41,SneakingSuspicion666,2024-10-27
228,Visiting my brother in Taipei,"Hey guys and gals,
My brother is an expat in Taipei, and he has a spare bedroom. Before my brother moved to Taiwan the country was not on my radar what so ever. But knowing i could visit him + sleep at his place it seems like an insane idea not to visit him and find out what Taiwan has to offer! I was thinking of visiting in february so i can also see some festivals like the yanshui fireworks festival. 

I basicly have 2 questions:
1) how long should i visit Taiwan knowing i would want to end most if not all of my days in Taipei as my brother will be working during the day.

2) where would you reccomend me to go on my trip?

Thanks for your help! 
",https://www.reddit.com/r/taiwan/comments/1gdgdl3/visiting_my_brother_in_taipei/,self.taiwan,2024-10-27 17:32:52,MightyThad,2024-10-27
229,Kaohsiung port.,Taken from the ferry.,https://i.redd.it/726oh2p02cxd1.jpeg,i.redd.it,2024-10-27 17:21:50,Final_Company5973,2024-10-27
230,"Weekly Travel, Questions, &amp; Mandarin Thread","This thread is for:

* Travel queries &amp; information.
* Generic questions that most likely won't generate discussion as their own thread.

That said, we're also trying to allow more discussion-based text threads, so hopefully this will help dilute the ""news flood"" that some users have reported.

*Use upvotes to let people know you appreciate their help &amp; feedback!*

Most questions have been asked on this sub. You will find great resources by using the search function and also by using Google. To prevent the sub from being continually flooded with itinerary requests or questions about where to find [random object], please post questions and requests here.
___
本文為以下議題開設：

* 旅行相關問題與資訊分享。
* 不需要另外開設討論區的通用性問題。

*歡迎大家點擊“讚”向其他人傳達你的感激與回饋！*

儘管是使用中文討論，煩請遵守Reddit本站與討論區規則。
___
**This thread's default sort is NEW.**

**This thread will change on the first of every month.**",https://www.reddit.com/r/taiwan/comments/1gde89w/weekly_travel_questions_mandarin_thread/,self.taiwan,2024-10-27 16:00:23,AutoModerator,2024-10-27
231,Gift Ideas for friend,"Hi! I've perused answers to similar questions before, but I'm wondering if anyone has recommendations for something more specific:

One of my friends has been having a difficult  time lately, so I while I'm in Taipei for 2 weeks for work, I wanted to find something nice for her. She's artstic and loves tea, so I was definitely going to pick up some tea for her. But I'm also looking for something locally made by an artist/artisan, like a tea cup, small wood carving, etc. 

What are your recommendations? Where should I look? I have the weekend free so I would have plenty of time to peruse.

Thank you in advance!",https://www.reddit.com/r/taiwan/comments/1gddqc2/gift_ideas_for_friend/,self.taiwan,2024-10-27 15:38:19,TeaAndGrumpets,2024-10-27
